{
  "$schema": "https://json-schema.org/draft/2020-12/schema",
  "$id": "https://astro-knowledge.local/schema/transit-house.schema.json",
  "type": "object",
  "additionalProperties": false,
  "required": ["id", "kind", "transiting", "house", "tldr", "body", "business", "shadow", "advice", "source", "voiceNeutral", "status"],
  "properties": {
    "id": { "type": "string" },
    "kind": { "const": "house" },
    "transiting": { "type": "string" },
    "house": { "type": "integer", "minimum": 1, "maximum": 12 },
    "tldr": { "type": "string" },
    "body": { "type": "string" },
    "business": { "type": "string" },
    "shadow": { "type": "string" },
    "advice": { "type": "string" },
    "note": { "type": "string" },
    "source": {
      "type": "object",
      "additionalProperties": false,
      "required": ["title", "pages"],
      "properties": {
        "title": { "type": "string" },
        "pages": {
          "type": "array",
          "items": { "type": "integer" }
        }
      }
    },
    "voiceNeutral": { "const": true },
    "status": { "enum": ["TODO", "DRAFT", "REVIEWED", "LIVE"] }
  }
}
