{
  "id": "mercury-4",
  "kind": "house",
  "transiting": "mercury",
  "house": 4,
  "tldr": "Mercury through the 4th house clarifies home, family, privacy, and emotional foundations.",
  "body": "When Mercury moves through your 4th house, it puts language around home, family, privacy, memory, living space, roots, and what is happening behind closed doors. You may notice what is happening privately, what your home needs, or what old family and memory patterns are bringing into the present.\n\nSomething may need to be said, decided, written, questioned, or understood. It can help you name the question, make the call, or sort through the moving pieces.\n\nThe useful side is that this timing can make the next honest move easier to see. This is useful for tending to the base of your life instead of only managing what other people can see.\n\nThe caution: Watch for overthinking the situation until the simple next step disappears. The risk is retreating so far inward that nothing gets named or handled.\n\nMercury moves through this house for a few weeks. Use the mental activity for clarity. Say the thing plainly, then let the answer tell you what comes next.",
  "business": "It can help you name the question, make the call, or sort through the moving pieces. This is useful for tending to the base of your life instead of only managing what other people can see.",
  "shadow": "Watch for overthinking the situation until the simple next step disappears. The risk is retreating so far inward that nothing gets named or handled.",
  "advice": "Use the mental activity for clarity. Say the thing plainly, then let the answer tell you what comes next. This is useful for tending to the base of your life instead of only managing what other people can see.",
  "source": {
    "title": "As Above, So Below: A Guide to Astrology for Tarot Readers",
    "pages": [
      574,
      575,
      576,
      577,
      578,
      579,
      580,
      581,
      582,
      583,
      584,
      585,
      586,
      587,
      588,
      589,
      590,
      591,
      592,
      593,
      594,
      595,
      596,
      597,
      598,
      599,
      600,
      601,
      602,
      603,
      604
    ]
  },
  "voiceNeutral": true,
  "status": "REVIEWED"
}
