{
  "id": "mars-9",
  "kind": "house",
  "transiting": "mars",
  "house": 9,
  "tldr": "Mars through the 9th house brings focus to travel, study, belief, publishing, law, and spiritual perspective.",
  "body": "Mars transiting the 9th house energizes travel, study, belief, publishing, law, and spiritual perspective. For about six weeks, drive, heat, conflict, desire, and action move through this part of life, making it harder to ignore what needs attention here. This is an activation transit: it brings momentum and courage, but also heat that needs a clear outlet.",
  "business": "Mars supports learning, teaching, and widening the view: make the call, update the plan, handle the visible task, and let the transit move something practical.",
  "shadow": "Impulsiveness, conflict, burnout, or using certainty to avoid humility.",
  "advice": "Aim the fire in the 9th house deliberately. Work with travel, study, belief, publishing, law, and spiritual perspective without letting the transit run the whole room.",
  "source": {
    "title": "authorized Project Author source material",
    "pages": []
  },
  "note": "Authored from Project Author house-transit material.",
  "voiceNeutral": true,
  "status": "DRAFT"
}
