{
  "id": "sun-2",
  "kind": "house",
  "transiting": "sun",
  "house": 2,
  "tldr": "the Sun through the 2nd house brings attention to money, security, values, and self-worth.",
  "body": "When the Sun moves through your 2nd house, it brings attention to money, security, possessions, self-worth, spending, income, and what helps you feel steady. You may notice what feels worth keeping, what costs too much, and what would help life feel more stable.\n\nSomething may feel more visible, energizing, exposed, or ready to be claimed. It can help you notice what needs more life, honesty, or direct attention.\n\nThe useful side is that this timing can make the next honest move easier to see. This is useful for making a more honest choice around resources, desire, and value.\n\nThe caution: Watch for needing validation so badly that you miss what actually feels true. The risk is confusing immediate comfort with real security.\n\nThe Sun moves through this house for about a month. Use the visibility well. Put attention where it gives you more life, not just more approval.",
  "business": "It can help you notice what needs more life, honesty, or direct attention. This is useful for making a more honest choice around resources, desire, and value.",
  "shadow": "Watch for needing validation so badly that you miss what actually feels true. The risk is confusing immediate comfort with real security.",
  "advice": "Use the visibility well. Put attention where it gives you more life, not just more approval. This is useful for making a more honest choice around resources, desire, and value.",
  "source": {
    "title": "As Above, So Below: A Guide to Astrology for Tarot Readers",
    "pages": [
      506,
      507,
      508,
      509,
      510,
      511,
      512,
      513,
      514,
      515,
      516,
      517,
      518,
      519,
      520,
      521,
      522,
      523,
      524,
      525,
      526,
      527,
      528,
      529,
      530,
      531,
      532,
      533,
      534,
      535,
      536,
      537,
      538,
      539,
      540
    ]
  },
  "voiceNeutral": true,
  "status": "REVIEWED"
}
